id,content,usages,type,source
22,"As I look down the stairs I see Aaron, but it does not look like Aaron or feel like Aaron. He is unrecognizable.",16,0,Whitmore Mansion
16,"Aaron now returns, and I begin forcefully pushing him into the room with the spirit board.",16,0,Mountain Oaks Mayhem
118,The mob can turn on you on a [bleep] dime.,14,3,The Riviera Hotel
4,I want Aaron to go into this crawlspace by himself.,16,0,
152,"This is like some type of dark tentacle of some type of spiritual creature, entity. And this was in your bedroom.",14,3,Emergency in Elk Grove
67,"Dude, are you kidding me?!",14,3,
40,I'm suddenly feeling angry and aggressive...,21,2,
71,"There''s an ice-cold mass right here, FEEL!",14,3,
41,I can feel the fear all around me.,21,2,
12,"Much to Aaron''s delight, I am locked down in the dark.",16,0,Battle of Los Angeles
2,"Aaron, go lock yourself in the basement!",16,0,
24,"Aaron, I want you to lay down on the futon.",16,0,Crisis in Long Beach (House Calls)
149,"I can feel you, we can feel you, my friend Aaron and I.",14,3,Territorial Enterprise
209,"Capturing ground-breaking proof... [of how to pronounce '"mercury'".](https://www.youtube.com/watch?v=mjhBo0u6-wU)",3,4,
210,"There are things in this world we will never fully understand... [like how to pronounce '"mercury'".](https://www.youtube.com/watch?v=mjhBo0u6-wU)",3,4,
7,Don't let Aaron out of the basement until I say so!,16,0,
26,"Aaron, lay in the bed, would you?",16,0,Mayhem in Marquette (House Calls)
6,"I believe that a spirit is strongly attracted to Aaron, because he is showing the most fear.",16,0,
30,"If there''s something to know about our good friend Aaron Goodwin, is he''s the clumsiest guy that we know.",16,0,Chaos in Emmaus (House Calls)
47,Did someone just scratch me?!,14,3,The show's old intro
74,It's icy cold all around me!,14,3,
44,I'm having a little bit of residual feelings.,21,2,The Great Saltair Curse
38,"I feel intense anger towards Billy, stay back!",21,2,
113,Don't ever lunge for a donkey's ass.,14,3,Yorktown Hospital
77,The hearing in the left side of my face went numb.,14,3,
37,I'm feeling an uncontrollable rage coming over me.,22,2,
168,This is one of the most intense experiences of my life.,14,3,LA Police Station Invasion
60,Do you wanna tickle my big ol' long toes?,14,3,
207,There is no relaxation.,14,3,
69,DUDE WHAT WAS THAT?!,14,3,
8,Look at Aaron's arm hair!,16,0,
80,I just felt an unnatural shift in the energy.,14,3,
3,I decided that I'm gonna lock Aaron in here alone.,16,0,
79,"Guys, I''m being affected!",14,3,
23,"Aaron starts to leave us, and it makes me angry.",17,0,Petrified in Pahrump
73,Feel this! It's freezing right over here!,14,3,
66,"Bro, are you serious?!",14,3,
11,I just saw Aaron and I wanted to kill him.,17,0,Poveglia Island
132,You know who has experience in guys beds? Nick Groff.,14,3,Olde Fort Erie
276,There is a strange and powerful confusion that is penetrating all of us.,15,3,Los Feliz Murder House Part 1
56,C R E D I B I L I T Y,14,3,
122,I'm not gonna talk to you about what kinda cars I have or what's in my refrigerator.,14,3,
5,"Aaron, get in the bed with me man, and we can feel the vibrations together.",17,0,S09E02
61,NEVER eat a Crockpot of beans before a paranormal investigation.,14,3,
39,I'm feeling so emotional at the moment. I just wanna cry!,21,2,
85,That's a class-A EVP right there!,15,3,
78,There has to be a portal over here!,14,3,
65,OMG DUDE!,14,3,
63,NO WAY BRO!,14,3,
36,I feel an overwhelming sense of sadness.,21,2,
42,"I''m feeling inexplicably uneasy, as if the building is aware of our presence.",22,2,
126,I think our human eyeballs - our living eyeballs - see this town as it is now.,15,3,Apache Junction
117,I love devirginizing places.,14,3,
70,"Dude, is it getting cold in here?!",14,3,
84,This evidence is extremely compelling.,14,3,
87,"That is a crystal-clear, intelligent response.",14,3,
75,"I''ve got goosebumps on my arm, FEEL!",15,3,
175,I have anxiety too. I feel it through this connection.,15,3,Mayhem in Marquette (House Calls)
45,I feel like a spiritual fishing lure that is getting bites from the mean barracuda.,21,2,Letchworth Village
62,BRO!,14,3,
58,Bill Chappell can't give us an explanation.,14,3,The show's intro
83,IT'S CLIMBING UP YOU!,14,3,
68,SHHHHHH! Be quiet! Listen!,14,3,
64,DUDE!,15,3,
76,It's giving me rage!,14,3,
82,"There''s a blinding pain in my back; super, super piercing.",14,3,Lost Souls of the Berkeley
90,A light orb just shot into {author}'s arm!,14,3,
43,I feel physically drained at the moment; the spirits are feeding off my energy.,22,2,
59,You want to pick on someone? Pick on me!,14,3,
158,Just breathe deeply. Let your body become a part of the fabric of this location.,14,3,Montecito Mansion Of Mystery
218,{author} is mocking the Holy Trinity.,58,6,
213,"Did you know that '"situation'" is correctly pronounced '"sid-ju-ation'"?",17,5,
46,I feel like there's something here that wants me to connect with it.,22,2,Petrified in Pahrump
112,Let's just call this a demon spiderweb.,15,3,Letchworth Village
124,This is the part of the Astral plane that contains the most mystery.,14,3,Battle of Los Angeles
174,You guys be careful because that could have been a little imp.,14,3,Crisis in Long Beach (House Calls)
169,You in there? Let's go. Come out of your clothes. Come in here.,14,3,LA Police Station Invasion
96,*{ DEBUNKED }*,14,3,
136,You really don't understand what I experienced when I held that foot in my hand.,14,3,
89,A light anomaly just shot into {author}'s head!,14,3,
266,"Aaron '"voluntarily'" goes into the closet.",16,0,Old Bullion Plaza School
211,"We want answers... [for the pronunciation of '"mercury'".](https://www.youtube.com/watch?v=mjhBo0u6-wU)",3,4,
263,I just felt wind.,14,3,Old Bullion Plaza School
91,A ball of light just shot into {author}'s chest!,14,3,
125,I'm the official brothel inspector.,14,3,Apache Junction
162,I lost my breath. I got really lightheaded right here.,14,3,Whitmore Mansion
147,I feel like I have a weird connection to Mark Twain.,14,3,Territorial Enterprise
106,This is the actual bullet hole. Of the bullet.,14,3,Gettysburg
93,BRO! A mass of static energy just shot through my body!,14,3,
200,"Well, I hate slavery.",15,3,
119,That was the most romantic paranormal experience interview I've ever done.,14,3,Hellfire Caves
215,"Dude! It''s supposed to be spelled as '"sidjuation'".",17,5,
108,"I just felt something grab my ass... like, hard, Nick! Hard, I could feel like this on my-on my BUTT!",14,3,Gettysburg
204,Are the ghosts mistaking Aaron's digital recorder for a bomb!?,14,3,Kell's Irish Pub Restaurant
141,It's pitch darkness.,15,3,The Great Saltair Curse
170,That's exactly what she said.,14,3,Petrified in Pahrump
178,"We don''t call this ghost hunting, even in jest.",14,3,I am Haunted: Living Life Through the Dead (Book)
133,It just feels like these raindrops are the tears of the orphans that came here.,15,3,Twin Bridges Orphanage
165,"As soon as I step foot in this room, I am overwhelmed by an aggressive energy that feels like it''s circling around me.",14,3,LA Police Station Invasion
205,Do these people know they're being sandwiched between 2 layers of demonic energy?,14,3,Kell's Irish Pub Restaurant
98,I just received a massive EMF spike.,14,3,Lost Souls of the Berkeley
95,We could not debunk this as being some kind of insect.,14,3,
163,What are we feeling? You know that we're feeling you.,15,3,Whitmore Mansion
146,They're pulling the heat from around me - the thermal heat energy.,15,3,Terror at the Toy Shop
137,This is the first time I've ever heard of a West African Nail Fetish Hate God!,14,3,
130,Being scalded by that pot sticker has jolted my mind back to the task at hand.,14,3,Chinese Town of Locke
160,"Right now, the entire house is complete dark.",14,3,Montecito Mansion Of Mystery
199,There is not good vibes in here. At all.,14,3,
153,It was a blight or right blight bright light white.,15,3,Emergency in Elk Grove
171,"As Billy feels a bad vibe, this anomaly shoots behind him.",15,3,Petrified in Pahrump
97,*\* Unexplained noises \**,15,3,
88,I saw a dark mist with my own eyes!,14,3,
206,"We''re here, and yes, I am provoking.",14,3,
57,"Our credi-bili-ty, our reputation.",15,3,The show's intro
212,"I can''t give you an explanation... [of the pronunciation of '"mercury'".](https://www.youtube.com/watch?v=mjhBo0u6-wU)",4,4,
81,"Ooh, I just got frozen!",14,3,Lost Souls of the Berkeley
131,"Aaron and I are white, but we''re not a threat to you.",14,3,Chinese Town of Locke
94,THERE'S A TEENY TINY FIGURE ON MY RECORDER!,14,3,
116,"We''re not here for beauty, we''re here for darkness.",14,3,
144,This costume shop just got a hell of a lot more [bleep] creepy.,15,3,Terror at the Toy Shop
219,You're mocking the Holy Trinity by saying the number '3'.,57,6,
216,"Bro! Please correct your spelling of '"sidjuation'".",17,5,
166,"I am hot, but right now, my legs are chilling up.",14,3,LA Police Station Invasion
86,That was one of the most chilling EVPs we've ever captured.,14,3,Lost Souls of the Berkeley
120,"His heart was stolen. Not by a girl, his physical heart.",14,3,Hellfire Caves
115,I've never never felt emotions.,14,3,Kentucky Slave House
176,This is why I wanted to send somebody in solo. We need to examine that lamp.,14,3,
127,I have hydrogen in my farts.,14,3,Apache Junction
121,"Ultraviolet lights are purple, because they are that color.",14,3,
111,"In the middle of an interview, you never just get up, fart, or run away. As long as we get them things out of the way, we can continue, sir.",14,3,Letchworth Village
129,"I''m a funny guy, you know? I like to laugh... play games... if that''s alright...",14,3,
92,I just saw a dark shadow figure behind you!,14,3,
188,"In the dream, I killed people knowing that it wasn''t morally wrong.",14,3,I am Haunted: Living Life Through the Dead (Book)
161,"As I always say, these locations that we investigate, we don''t find them... they find us.",14,3,Mountain Oaks Mayhem
140,Are you making me angry? Are you giving me aggression?,14,3,The Great Saltair Curse
217,"I will lock you in the basement alone if you misspell '"sidjuation'" again!",17,5,
262,What's happening right now is very chilling.,14,3,Henderson Hell House
21,"Are you just pressing on my chest? Because you don''t want me up here, right? I don''t like that... Aaron, get up here.",17,0,Whitmore Mansion
135,I can hear you mumbling and saying things that are annoying me.,15,3,
208,Do you want to come play with my balls?,15,3,Stone Lion Inn
54,Capturing ground-breaking proof of the paranormal.,14,3,The show's intro
53,We have worked years to build our credibility... our reputation...,14,3,The show's intro
18,Aaron has a strong feeling to go to the basement with the Polterpod.,16,0,Whitmore Mansion
156,"If I could say this humbly, but also confidently: we specialize in ghost communication.",14,3,Return to the Riviera
186,I'm NOT one of those goons with fame-injected egos who are cast in a show for a season or two and think they know everything about ghosts.,14,3,I am Haunted: Living Life Through the Dead (Book)
269,"Once again, I''m not feeling like myself.",21,2,Acadia Ranch Sanitorium
195,The Devil: just leave him alone.,14,3,I am Haunted: Living Life Through the Dead (Book)
10,"Aaron, I want you to go into the ladies'' room.",17,0,Lost Souls of the Berkeley
139,There's a heaviness in the air that begins to trigger something inside of me.,14,3,The Great Saltair Curse
17,"We immediately go inside. And because Aaron is being affected, we follow his lead.",16,0,Whitmore Mansion
201,All it takes is one push and you can critically injure me! Do it!!,14,3,
13,"Aaron, because that spirit just called you by first and last name, I''m sending *you* there to investigate tonight.",17,0,Territorial Enterprise
150,A very negative spirit attachment followed me home and affected me for about 3 days. I can't wait to come back and do it again.,15,3,Territorial Enterprise
159,"I want all of us to hum together, so we get in perfect synchronicity, and I want us to again, calibrate our energy.",14,3,Montecito Mansion Of Mystery
123,"Sometimes you go to someone''s house and you don''t know if there''s gonna be 10, 20, 40, 50 people at this party, or you''re gonna go there by yourself and talk to a bunch of walls.",14,3,Battle of Los Angeles
191,"We won''t send a kid into space, but we''ll give him a portal to another dimension and invite a demon in.",14,3,I am Haunted: Living Life Through the Dead (Book)
214,"I''m feeling anger and rage because you can''t spell '"sidjuation'"!",16,5,
49,STOP! Stop running!,14,3,The show's old intro
193,She was crying because she's been astral projecting herself and having a sexual relationship with me in the astral plane for a long time.,14,3,I am Haunted: Living Life Through the Dead (Book)
180,Jay is like Alex Trebek on Speed.,14,3,I am Haunted: Living Life Through the Dead (Book)
142,You wanna push me? Let me feel your touch!,14,3,The Great Saltair Curse
192,I've explored the worst holes on earth and found beauty and wonder in places most people find disgusting.,15,3,I am Haunted: Living Life Through the Dead (Book)
224,zÌµÍÍÌ©oÌ·Í’Í‡Ì±zÌ¶ÌÍ‰ÌºÍ”oÌ¶ÌÍÌªÌ ÌµÌŒÌ€Ì¤Ì³Ì¯zÌ´ÌˆÍˆoÌ¶ÌÌˆÌ»Ì§zÌµÍ Ì„Í˜Ì—oÌ¸Í‘Ì»Í‰ ÌµÌŠÌ‰ÌªÌ–zÌ¶Í—ÌÌ¡oÌ·Ì‚ÌšÌ•Ì£Í™zÌµÍ„Í‘Ì‹Ì«Ì³oÌ¸Ì•Í˜Ì¨Ì¤Ì¬ Ì¶Ì‰Í’Ì„Ì®Ì®zÌ´Ì‘ÌÌ²oÌ¶ÌÌšÍ›ÌªzÌµÌ†Ì°oÌ´ÌšÌƒÍšÌ© ÌµÌŠÍƒÍÌ¦Í™zÌ·Ì¾Í†ÌŠÌ«ÍoÌµÌÍ›Ì£Ì—zÌ·Í‚Ì‚Í˜Ì¬Ì¨oÌ¸ÌÌ…Ì„Ì–Ìº Ì´Ì€Í‘Ì…Ì¦zÌ¶Ì¾Í†Ì¿Ì¤oÌµÍ˜Ì€Ì‚ÌºÍ–zÌµÌ€Í˜Ì±Ì¨ÍœoÌ´ÌÌ¼Ì¼ Ì·Í‹ÍƒÌ®Ì™Ì§zÌ¶Í›Í—ÌÌºÌ©oÌ¶Ì€ÍÍ”zÌ·Ì…ÌŒÌ…Í…ÍoÌ·Ì“ÌœÌ¢ Ì¶ÍŒÌÌ¹zÌ¸ÌÌ¾ÍÌ°ÍœoÌ´ÌÍ‹ÍzÌ¶Ì¿ÌÍ†ÍšÌ™oÌ´Ì•Ì§ Ì¶ÌÌ†Ì‚ÍÌ°zÌµÌÍ“ÌŸÍšoÌ·Ì¾Ì¤Ì¼zÌ¶Í ÍŒÌ¾ÌoÌ¸Ì‘ÍÌ›Ì ÍÍ‡ Ì¶ÌÌˆÍ†Í”Ì¹zÌ´ÍÌ•Í„Ì oÌ´ÌÍ‘ÍÍ–zÌ·ÌƒÌ¿ÌŸÍœoÌµÍ€ÍÍÌ¤ Ì¶Ì…Ì‡ÍÌ¨zÌ¶ÌŒÌ‹Í€Ì¢Ì¥Í”oÌ·Í’ÌªzÌ·Í€Ì°oÌ¶Í„ÌŒÌ²Í‰Ì¯ Ì·Ì‹Í„Í“ÍÌzÌ¶Ì‘Ì€Ì‚Ì¯Ì¨Í™oÌ´Í‘ÍŒÌ—zÌ·Ì‹Ì¼oÌµÌ‘Í… Ì´ÌˆÌºzÌ¸Í›Ì¢Ì oÌ·Ì‚ÍÌ¤zÌµÌ‘ÌÍÍÌ¡Ì­oÌ·ÍŒÌ˜Í• Ì·Ì”Í„Í‘Ì£zÌ·ÌÍ”oÌ·ÍÌŸzÌµÍÌ½Ì®oÌ´Í†Ì¿Ìª Ì´Í†Ì½Ì›Ì¹ÌŸzÌ¸ÌÌ—oÌ¶Í’ÍŠÌ°Ì¼Ì–zÌµÌ†Ì˜Ì°Ì¯oÌ¸Ì†Ì•ÍŒÍ”Í Ì¶Ì”Í—Í€Ì«Ì«Ì°zÌ¸Í›Í€Ì„Ì¢oÌ¸ÌÌÌ§zÌ·ÌÌšÍ›Ì¤oÌ´Ì’Ì» Ì´Í€Ì­Ì¯zÌµÍ„Í…Ì Ì–oÌ¸Ì…Í‚ÌœÌ¨zÌ¸ÍÌ†ÌÌœoÌ·Ì†Ì‡Ì¼Í• Ì´ÌÍ ÍÌÍ•Ì¡zÌ¸Í€Í ÌˆÌªoÌµÍ€Ì‰Í•Í–Ì¹zÌ·Ì“ÍŒÌ’Ì³oÌµÍ†Ì™ Ì´ÌšÍÌ©Ì©zÌ´ÍÍ›Í™oÌ¶Ì†Í–Í–Ì£zÌ¸ÌÌÍ“oÌ·Í‘Í•Í”Ì© Ì´Í€Ì’Ì‹ÍˆzÌ·Í Ì‚ÍšÍ•Í…oÌ¸ÌÍšÌ¥Ì°zÌµÍÌ‡Ì¹oÌ·Ì‚Ì‹ÌÌ¦ ÌµÌŒÍ˜Ì­Ì¨Ì­zÌ´Ì„Ì°Ì¥Ì°oÌ´Ì‘Ì’Ì½ÌªÌ°Ì¨zÌ¶ÌÌ¹oÌ´ÍÍ‚Ì˜ Ì·Ì…Ì‚Ì’ÍœzÌ¸Ì•Ì¨Ì°oÌ·Ì„Ì‹Í—Ì©zÌµÍ—ÌŸoÌ¶ÌÌ¯ Ì¶ÍÌ‡Ì–ÌœzÌµÌ›ÍŠÌ›Ì¡ÌoÌ·ÌƒÌ½Í™Ì—zÌ¸Í Ì€Ì•Ì¬Ì ÌœoÌ´ÌÌ“Ì¹ Ì¶Í˜ÌˆÌŒÌŸzÌ´ÍÌÌ™oÌ¸Í†Ì³zÌ´Ì¾Ì½Ì²oÌµÍ‹ÍÌ³Ì˜ Ì¸Ì¿ÌŒÍ‡zÌ·Ì›Í™oÌ¶Í‘Ì•Í“zÌ´Ì„Ì€Ì±oÌ´Ì¿Ì•Í™Ì Ì·Í˜ÌœzÌ´ÌÌ…Ì™ÌŸoÌ´ÍÍÌ¢Ì²zÌ´Í‹ÍŠÌ§oÌ·Ì€Ì¨Ì¨Í Ì·Í„Ì¹ÌªÌªzÌ¶Ì”Í ÍÌ—oÌ´ÍÌªzÌ¶Ì¾ÍšÌ¤Ì°oÌ¸ÌÌ§Í… Ì´ÍƒÍ„Ì°Ì³Í“zÌ´ÌÌÍ€Ì˜Í“Ì­oÌ´Ì¾ÍÌÍˆzÌµÍ„Í’Ì–oÌ·ÌÍÌÌ²Ìª Ì¶Ì’ÌŒÍ…Ì¡zÌ¸ÍÌ¹Ì§ÌªoÌ·Í ÌŒÌŒÌ¢ÍšzÌ·ÌÍÌ«ÌŸÍˆoÌµÌšÍ Í†Í‡ÍˆÌŸ ÌµÌšÌ‘ÌšÍ™zÌµÌÍÌÍ•Ì²oÌ¸ÌÌ‹Ì®Ì¥Ì§zÌ·Ì’ÍŠÌ–oÌ·Ì½ÌÍœÌ¦ Ì¸ÌƒÌ²zÌµÍŒÌ‘Ì™Ì¯ÌºoÌµÍ„ÍŒÌŒÍ…Ì«zÌ·Í‘Ì”Ì¡Ì¹ÌœoÌ·Ì‚ÍŒÌÌ™ Ì¸Ì‚Ì¢Í‰Ì©zÌ´ÍƒÍˆoÌ·ÌÌ½Ì‰ÍÌœÍzÌ¸ÌÍoÌµÌ‚ÌˆÌÌ«Í“ Ì¶Ì½Í‘Í›Ì¥ÌzÌ·Í Í˜Ì»ÍˆoÌ¸Ì“Í„Ì¤zÌµÌŠÍÌƒÌ¼Í‰Ì°oÌ·Ì„Ì¿Í†Ì«Ì³ Ì´Í€Ì¦Ì¼zÌ¶Í‚Ì¾Í‚ÌªoÌ¶ÌŠÌ‘Ì›Ì¥ÍšzÌµÌ”Ì”Ì¯Ì¬oÌ¸Í€ÌŒÌ¡ Ì´Í’Í„Ì‹ÌÍˆÌ™zÌ¶Ì€ÌˆÍŒÌ±ÌªoÌµÌšÌÍÌ³Ì¡zÌ·ÌšÍ–Ì©Ì¥oÌ´ÍÌŸÌ® Ì·ÌÍzÌ¶Ì…Ì”Í‹Ì©oÌ·Í„Ì–zÌ¶ÍÍ„Ì¢Í‡oÌ¸Í’Ì…Ì Ì´Ì½ÌˆÌ†Í…Í“zÌµÍƒÌœÍ™Ì¯oÌ·Ì€ÍÌzÌ´Í‚Ì¼Ì—Í™oÌ¸ÌÌ©Ì²Í Ì¸ÌˆÌŒÌ£Ì–zÌ¸Í—ÌÌŸoÌ·Í’ÌŠÌ¡zÌ·ÌšÍÍ‡Ì oÌµÍƒÌ¨Í‡ Ì´ÌŠÍ Ì½ÌŸzÌµÌ‰Í Í‡ÌÍ…oÌ·Ì‡Í‚Í‚Ì²Ì—zÌ´ÌˆÌ‰Ì½ÍˆÌ¥Ì¢oÌµÌ’Í Ì²Í Ì¸Ì‡ÍÌ•Ì¯Ì£Ì°zÌ¸ÍÍoÌ¸ÌÍŠÌ«zÌµÌŒÌ€Ì½Í“Í‡oÌ·ÌŒÍ„Í’Ì©Í“Ì« Ì·Ì‚ÍÌ…ÌŸzÌ¶Ì€ÌšÍ”oÌ¸ÌˆÌƒÌÍœzÌ¶Ì‹ÍˆoÌ´Í’Ì½Ì¬ ÌµÌ“ÌƒÍÌªÌ®zÌ¸ÌšÍˆÍÍoÌ´ÍÌ¥Ì£zÌ¸Ì‘Ì¾Ì»Ì—Ì¨oÌ´ÌÍ—Ì¹ÌŸ Ì¶Í„ÍˆzÌ¸ÍÍ€Í‚Ì³oÌ´Í„Ì‚Í•zÌµÌÌ¨Ì¨oÌ´ÍŒÌ Ì¸Ì¿Ì¾ÌŒÌ²Í‡ÌŸzÌ¸Ì‚Ì…Ì™Í‰oÌ´ÍÍ›Ì³Ì°zÌµÌšÌ±Ì¹Ì­oÌ´Ì‚Ìº Ì·Ì‹ÌˆÌœzÌ¸Í€Ì»oÌ¸Í„Í—ÌªÍ”zÌ´Ì„ÌÌ°Ì¡ÍoÌ·Í›Ì†ÌÌ²Ì» Ì·ÌšÍ„Ì¨ÌzÌ¶Ì¿Ì¾Ì³oÌ¸ÌƒÌ¼Í‰zÌ¶Í„ÌÌ²oÌ¸ÍŠÌ½Ì®Ì®Ì¹ Ì¸Ì‚Ì¥Ì°zÌ¸Ì„Ì•ÍƒÌ²oÌµÌ›Ì¡zÌ¸Ì“Ì€Í„Ì—Ì¯Í”oÌ¸Í€Ì¾Ì©ÍÌ™ ÌµÌ”Ì¿Í—Í•Ì®Ì¯zÌµÍ„ÌŠÌÌ¹ÍoÌµÍ—Í“Í“zÌ¸Ì‡Í ÌŸÍœÌ»oÌµÌÍœ Ì´ÍŠÍÌ­Í•ÌºzÌ¶Í€Ì°ÍšÍ“oÌ¸Í›ÍŒÍ‡Í“zÌ¸Í—ÍƒÌÌ«oÌ¸ÌÍÍÌ¤ÍˆÌ¥ Ì¸Í›Í†Ì‡Ì¹Í™zÌ´Í„Ì‹Ì­Ì¡ÍoÌ·Í—Ì£Ì±Ì—zÌ¸ÍƒÍÌ—ÍoÌ¶ÌÌ¬ Ì´Í›Ì‡ÍœzÌ¸Í˜Ì–oÌ¶Ì…Ì‹Ì‘ÍÍ…zÌ´Í†Ì˜Ì˜oÌ´ÌÍ… Ì¸Í‹ÍŒÌ²Ì˜Í–zÌµÌ‹Í†Ì“Ì¹Ì­Í•oÌ¸ÍÌ‰Ì¢ÌŸÌ­zÌ¶Í€ÌŒÍ“Í‡Ì¯oÌ¶ÍÍ’Ì­Ì¯ Ì·ÍÍ„ÍšÍ‰Ì­zÌµÍ€ÌŒÌ ÍˆoÌ·Í Ì“Ì¥ÍœÍ•zÌ¶Í€Ì«Ì£Ì¢oÌ´ÌŒÍœ Ì¶Ì…Í›Í–zÌ¶ÌÌÍ“oÌ¶Í ÌšÌ¾Í•zÌ´Í—ÌƒÍˆoÌ¶ÍÍ†Ì‚Ì® Ì¶Ì’Ì„Ì¦zÌ·Ì…Ì¤oÌ¸ÌŠÌ½Ì®zÌ¶Í˜Ì‚Í‘Ì³ÍˆÌ¡oÌ¶Í†ÍŒÌ€Íˆ Ì¸Í†Í†Ì•Ì¯Ì™Ì¥zÌ¶ÍÍƒÍÌ¬Ì²oÌ¸Ì”Í–Ì¢ÌzÌ¸ÌÍÍ”Ì®oÌ´Í€Ì”Ì”Ì¹Í‰ ÌµÍÍŠÌ¼zÌ·Ì„Í‘Ì‚ÌÌ¢Í•oÌ¶Í‘Ì£zÌµÌ†ÌŒÍ‡oÌµÍ†Ì£ Ì¶Ì“Ì±ÍšÍ“zÌ·ÍÌÍ Ì—Ì¡Ì®oÌ¸Ì›ÌÍÌ«Ì zÌ´ÍŠÍÍ—Ì³oÌµÌšÍÌ§ÌªÌ­ Ì¶Ì…ÍÌ»Í–zÌ¶ÌŠÌ…Ì‹Í“Í‡oÌ¸Ì”Ì Í‡zÌ¶Í„Ì¬oÌ¸Ì½Í‘Í–Í–Ì— Ì´ÌšÌ„Í‘Ì¯Í–Ì zÌµÌÌ”Ì¼ÌªoÌ¸ÌÍ‰zÌ´ÍƒÌÌ¾Ì³ÍšÌ¬oÌ¸Í€Ì­ Ì·Ì’Ì‰Ì¿Í“Ì¢zÌ´ÍÍšÌ˜Í™oÌ·Ì‚Í™zÌ¶Ì€ÌÍÌ¤Í‰oÌµÍ†Í‹ÍÍ™Íˆ Ì´Ì¾Ì¥zÌ´ÌÌˆÌ•Ì¬Ì­Í™oÌ´Í Ì„ÌÍzÌµÍ‚Ì½Í…Ì˜oÌ¶Ì•Ì…ÍƒÍš Ì¸ÍŒÍ†ÍˆÌ§zÌ·ÍƒÌÍ—Ì¨oÌ´Ì‚Ì›Ì†ÍˆÍzÌ¶Í€Ì™ÌŸoÌµÍ›Í†ÍÌ« Ì¸Ì€Ì‘Ì‚Ì–,24,8,
52,We want answers... ^(answers),14,3,The show's intro
267,"No, no, no! Stop! Stop it! I''m being serious.",14,3,Old Bullion Plaza School
187,"Nobody''s perfect, unless you''re Paris Hilton - wait, she has gigantic clown feet.",14,3,I am Haunted: Living Life Through the Dead (Book)
110,"It literally felt like we were in the video game '"Doom'".",14,3,Fort Chaffe
179,It's like I'm trying to overdose on ghosts. I'm an addict.,14,3,I am Haunted: Living Life Through the Dead (Book)
226,I never believed in ghosts until I came face-to-face with one.,14,3,The show's old intro
181,This day and age makes me sick sometimes.,15,3,I am Haunted: Living Life Through the Dead (Book)
157,And that's what we do when we see evil -- run like hell.,14,3,Hill View Manor
274,Are you eating a beef stick? In the midst of all of this you're eating a beef stick?,14,3,Acadia Ranch Sanitorium
72,"I feel an ice-cold pocket of air, as if something is manifesting!",14,3,Lost Souls of the Berkeley
275,"At this moment, one of our X-cams in the men''s bathroom captures something compelling.",14,3,Nightmare at the Roxie
164,"Are you here, little kid? Don''t be afraid.",14,3,Whitmore Mansion
272,"Ow, Billy, I''m getting that pricking feeling!",21,2,Nightmare at the Roxie
265,"I continue trying to communicate with this female, but she never speaks again.",14,3,Old Bullion Plaza School
227,Aaron can go from happy and laughing to Dark Aaron in a second. I call him The Complainer.,17,0,I am Haunted: Living Life Through the Dead (Book)
228,"For the investigation, we need to find women, put masks on them, and and, uhhhh, have us recreate these orgies.",14,3,Hellfire Caves
203,The one thing we don't do is bitch about things.,14,3,Fort Chaffee
154,"This house was calling to me for something, in some psychic way.",14,3,Montecito Mansion Of Mystery
273,"The guy is connecting with me, wants my energy. He knows that, like, I''m alpha, and he wants to use my power.",14,3,Acadia Ranch Sanitorium
190,"At one point, Darren''s wife came back to the house with her pants unbuttoned and belt undone and said that Zozo had attacked her.",14,3,I am Haunted: Living Life Through the Dead (Book)
221,*... understand...*,87,7,
271,I feel something inside my chest. It's cold inside my rib cage.,22,2,Nightmare at the Roxie
184,"We act goofy and strange sometimes, which the haters love. '"Oh, there they go, possessed again,'" they say.",14,3,I am Haunted: Living Life Through the Dead (Book)
167,I felt like I just got stung by a... a spider.,14,3,LA Police Station Invasion
189,I knew I had done something bad and freaked out a little. I actually ran to the bathroom to look for the knife I had used to stab everyone to make it sure it was still there and not bloody.,14,3,I am Haunted: Living Life Through the Dead (Book)
220,{author} mentioned the number '3'. They must be mocking the Trinity.,58,6,
172,I hear something move in the office. Then an energy shoots towards me.,15,3,Petrified in Pahrump
104,You have reached your final destination. *Hell.*,14,3,Poveglia Island
101,Sometimes we have feelings and we can't ignore them.,14,3,Riddle House
264,"Suddenly, I am overcome with fear and sadness.",14,3,Old Bullion Plaza School
48,RAW. EXTREME.,14,3,The show's old intro
155,"Something led me, personally, to this building. It called out, and I answered its call.",14,3,Montecito Mansion Of Mystery
270,"I suddenly feel inexplicably exhausted, to the point that I can barely stand up.",21,2,Nightmare at the Roxie
19,"As Aaron asks '"Why is he being affected'", an unexplained light anomaly shoots directly into him.",16,0,Whitmore Mansion
31,"Aaron, use extreme provocation.",16,0,Chaos in Emmaus (House Calls)
34,A witch doused Aaron in goat's blood during a pagan ritual. He wasn't the same after that ceremony.,16,0,I am Haunted: Living Life Through the Dead (Book)
223,zÌµÍŒÌ„Ì¦oÌ·Ì½Ì½Í—Í…Í‰Ì»zÌ·Í—Ì®Ì–oÌ¶Í‘Í˜Í”ÍÌ± Ì¶ÍŒÌŠÍ€Ì¢Ì©fÌ·ÌÍ‹ÌšÌ«oÌ´Ì’Í‚ÌÌºuÌ·ÌÌÌ–Ì nÌµÌŒÌ†Í•dÌ¶ÌÌ€ÌŒÌŸ Ì·Ì›ÌÌ™uÌ·Ì”ÌÌ¹Ì£Ì­sÌµÌ¾Ì— Ì´Í‘Ì€ÍŠÌ¼Í‰zÌ¸Ì¿ÌÍ…ÍoÌ¸ÌšÌ²ÌÍzÌ¶Í€ÌŒÍ€Ì¯Ì–Í“oÌµÌ„ÌƒÌ’Ì–Ì¬ Ì¶Ì‚Í”Ì®ÍˆfÌ¸Í˜Í€Ì’Ì±Í‡oÌµÍ‹Í‰ÌÌ—uÌ¸Ì“Ì¬nÌ´Ì‡Ì‘Ì¾ÍšÌ»dÌ¸Ì‘Ì“Ì­ ÌµÍ›Ì£uÌµÌŒÍ‰Ì©ÌsÌ´Ì†Ì—Í”Í‰ Ì¸Ì¿Í’Ì‚Ì¡Ì³zÌ¶ÌÌ Ì­oÌµÍ˜Ì•Í„Ì¦Ì±zÌ¸ÌƒÍŒÍ‹ÌÌ«Ì–oÌ¶Í˜Ì‹ÍÌ¼Ì«Ì Ì·ÌÌ€Í—Í…fÌµÍ‚Ì˜Í”oÌ¸Ì‘Í‘Ì‹ÍšÌ˜uÌ·Ì“ÌnÌ·Ì›Í‘Ì†Ì«ÍœÌ¢dÌ·ÌÌ°Í” ÌµÌ†Ì±ÍÌ«uÌ¶ÍÍÌ”Ì¥Ì¼Ì§sÌ·Ì•ÌÌÍ…Ì– Ì¶Ì¾Í‹Ì¼zÌ¶ÌˆÌ¢oÌ´ÌÌ¤Ì«zÌ´ÌŠÌ“Ì³ÌoÌµÌƒÍˆÍ“ Ì´ÌŠÌ‘Ì¹Ì²fÌ¸Ì”Í„ÌªoÌ´ÍŠÍÍuÌ·ÍÌŠÍ”Í‡Ì¥nÌ¶Ì‹ÍÍ„ÍˆÌ§dÌ´ÍƒÌ€Ì”Ì¯Ì§ÌŸ Ì¸Í†Í–Ì©uÌ¸Ì•Ì‰Í™sÌ·Ì„Ì¤ Ì´Í„Ì‚Ì¿Ì¤Ì¢zÌ¶Í‘Ì»Ì˜oÌ·ÌƒÍ‡ÍÌ©zÌ´Ì¿Ì‘Ì³Ì—oÌ¸Ì‰Ì…ÌœÍ” Ì·ÌˆÍ˜Ì˜Ì¨fÌ´Í›Ì‡Ì™Ì­oÌ·Í‘Ì„Ì¬Ì˜ÍuÌ·ÌÌ›Ì°Í™Ì—nÌ´Í‹Ì‡Ì½Ì°dÌµÍŠÌ®ÍˆÌ± ÌµÌ‹ÍuÌ´Í‚Ì³Ì³Ì¨sÌµÍƒÌÍŠÍ™ Ì´ÌˆÌŒÍÌ¯Ì¯,24,8,
50,You wanted us; you got us!,14,3,The show's old intro
294,"Now, the authorities are turning to us for help.",14,3,Ghost Island
293,"We are truly in a different dimension, guys.",14,3,Ghost Island
292,"It is at this time, I feel it is necessary to conduct a field-sobriety test on Billy.",14,3,Sutro Ghost Town
196,"I question God and Jesus, but I don''t question exorcists.",14,3,I am Haunted: Living Life Through the Dead (Book)
282,We are dealing with a very strong place.,14,3,Fear in Flagstaff
185,"In The Matrix, Keanu Reeves is injected with new programs and he evolves with each new packet of knowledge. It''s the same for me.",14,3,I am Haunted: Living Life Through the Dead (Book)
177,We swim in the spiritual ocean while everyone else is snorkeling.,14,3,I am Haunted: Living Life Through the Dead (Book)
